{"uuid":"49aa5bb6-26e7-4985-acc0-7d22bcf6401f","historyId":"eeca51f39663c7de9a29969cca20202b","status":"failed","statusDetails":{"message":"expected '{\"responseCode\": 200, \"products\": [{\"id\": 1, \"name\": \"Blue Top\", \"price\": \"Rs. 500\", \"brand\": \"Polo\", \"category\": {\"usertype\": {\"usertype\": \"Women\"}, \"category\": \"Tops\"}}, {\"id\": 2, \"name\": \"Men Tshirt\", \"price\": \"Rs. 400\", \"brand\": \"H&M\", \"category\": {\"usertype\": {\"usertype\": \"Men\"}, \"category\": \"Tshirts\"}}, {\"id\": 3, \"name\": \"Sleeveless Dress\", \"price\": \"Rs. 1000\", \"brand\": \"Madame\", \"category\": {\"usertype\": {\"usertype\": \"Women\"}, \"category\": \"Dress\"}}, {\"id\": 4, \"name\": \"Stylish Dress\", \"price\": \"Rs. 1500\", \"brand\": \"Madame\", \"category\": {\"usertype\": {\"usertype\": \"Women\"}, \"category\": \"Dress\"}}, {\"id\": 5, \"name\": \"Winter Top\", \"price\": \"Rs. 600\", \"brand\": \"Mast & Harbour\", \"category\": {\"usertype\": {\"usertype\": \"Women\"}, \"category\": \"Tops\"}}, {\"id\": 6, \"name\": \"Summer White Top\", \"price\": \"Rs. 400\", \"brand\": \"H&M\", \"category\": {\"usertype\": {\"usertype\": \"Women\"}, \"category\": \"Tops\"}}, {\"id\": 7, \"name\": \"Madame Top For Women\", \"price\": \"Rs. 1000\", \"brand\": \"Madame\", \"category\": {\"usertype\": {\"usertype\": \"Women\"}, \"category\": \"Tops\"}}, {\"id\": 8, \"name\": \"Fancy Green Top\", \"price\": \"Rs. 700\", \"brand\": \"Polo\", \"category\": {\"usertype\": {\"usertype\": \"Women\"}, \"category\": \"Tops\"}}, {\"id\": 11, \"name\": \"Sleeves Printed Top - White\", \"price\": \"Rs. 499\", \"brand\": \"Babyhug\", \"category\": {\"usertype\": {\"usertype\": \"Kids\"}, \"category\": \"Tops & Shirts\"}}, {\"id\": 12, \"name\": \"Half Sleeves Top Schiffli Detailing - Pink\", \"price\": \"Rs. 359\", \"brand\": \"Babyhug\", \"category\": {\"usertype\": {\"usertype\": \"Kids\"}, \"category\": \"Tops & Shirts\"}}, {\"id\": 13, \"name\": \"Frozen Tops For Kids\", \"price\": \"Rs. 278\", \"brand\": \"Allen Solly Junior\", \"category\": {\"usertype\": {\"usertype\": \"Kids\"}, \"category\": \"Tops & Shirts\"}}, {\"id\": 14, \"name\": \"Full Sleeves Top Cherry - Pink\", \"price\": \"Rs. 679\", \"brand\": \"Kookie Kids\", \"category\": {\"usertype\": {\"usertype\": \"Kids\"}, \"category\": \"Tops & Shirts\"}}, {\"id\": 15, \"name\": \"Printed Off Shoulder Top - White\", \"price\": \"Rs. 315\", \"brand\": \"Babyhug\", \"category\": {\"usertype\": {\"usertype\": \"Kids\"}, \"category\": \"Tops & Shirts\"}}, {\"id\": 16, \"name\": \"Sleeves Top and Short - Blue & Pink\", \"price\": \"Rs. 478\", \"brand\": \"Babyhug\", \"category\": {\"usertype\": {\"usertype\": \"Kids\"}, \"category\": \"Dress\"}}, {\"id\": 18, \"name\": \"Little Girls Mr. Panda Shirt\", \"price\": \"Rs. 1200\", \"brand\": \"Kookie Kids\", \"category\": {\"usertype\": {\"usertype\": \"Kids\"}, \"category\": \"Tops & Shirts\"}}, {\"id\": 19, \"name\": \"Sleeveless Unicorn Patch Gown - Pink\", \"price\": \"Rs. 1050\", \"brand\": \"Allen Solly Junior\", \"category\": {\"usertype\": {\"usertype\": \"Kids\"}, \"category\": \"Dress\"}}, {\"id\": 20, \"name\": \"Cotton Mull Embroidered Dress\", \"price\": \"Rs. 1190\", \"brand\": \"Kookie Kids\", \"category\": {\"usertype\": {\"usertype\": \"Kids\"}, \"category\": \"Dress\"}}, {\"id\": 21, \"name\": \"Blue Cotton Indie Mickey Dress\", \"price\": \"Rs. 1530\", \"brand\": \"Biba\", \"category\": {\"usertype\": {\"usertype\": \"Kids\"}, \"category\": \"Dress\"}}, {\"id\": 22, \"name\": \"Long Maxi Tulle Fancy Dress Up Outfits -Pink\", \"price\": \"Rs. 1600\", \"brand\": \"Biba\", \"category\": {\"usertype\": {\"usertype\": \"Kids\"}, \"category\": \"Dress\"}}, {\"id\": 23, \"name\": \"Sleeveless Unicorn Print Fit & Flare Net Dress - Multi\", \"price\": \"Rs. 1100\", \"brand\": \"Biba\", \"category\": {\"usertype\": {\"usertype\": \"Kids\"}, \"category\": \"Dress\"}}, {\"id\": 24, \"name\": \"Colour Blocked Shirt \\\\u2013 Sky Blue\", \"price\": \"Rs. 849\", \"brand\": \"Allen Solly Junior\", \"category\": {\"usertype\": {\"usertype\": \"Kids\"}, \"category\": \"Tops & Shirts\"}}, {\"id\": 28, \"name\": \"Pure Cotton V-Neck T-Shirt\", \"price\": \"Rs. 1299\", \"brand\": \"H&M\", \"category\": {\"usertype\": {\"usertype\": \"Men\"}, \"category\": \"Tshirts\"}}, {\"id\": 29, \"name\": \"Green Side Placket Detail T-Shirt\", \"price\": \"Rs. 1000\", \"brand\": \"Polo\", \"category\": {\"usertype\": {\"usertype\": \"Men\"}, \"category\": \"Tshirts\"}}, {\"id\": 30, \"name\": \"Premium Polo T-Shirts\", \"price\": \"Rs. 1500\", \"brand\": \"Polo\", \"category\": {\"usertype\": {\"usertype\": \"Men\"}, \"category\": \"Tshirts\"}}, {\"id\": 31, \"name\": \"Pure Cotton Neon Green Tshirt\", \"price\": \"Rs. 850\", \"brand\": \"H&M\", \"category\": {\"usertype\": {\"usertype\": \"Men\"}, \"category\": \"Tshirts\"}}, {\"id\": 33, \"name\": \"Soft Stretch Jeans\", \"price\": \"Rs. 799\", \"brand\": \"Polo\", \"category\": {\"usertype\": {\"usertype\": \"Men\"}, \"category\": \"Jeans\"}}, {\"id\": 35, \"name\": \"Regular Fit Straight Jeans\", \"price\": \"Rs. 1200\", \"brand\": \"H&M\", \"category\": {\"usertype\": {\"usertype\": \"Men\"}, \"category\": \"Jeans\"}}, {\"id\": 37, \"name\": \"Grunt Blue Slim Fit Jeans\", \"price\": \"Rs. 1400\", \"brand\": \"Polo\", \"category\": {\"usertype\": {\"usertype\": \"Men\"}, \"category\": \"Jeans\"}}, {\"id\": 38, \"name\": \"Rose Pink Embroidered Maxi Dress\", \"price\": \"Rs. 2300\", \"brand\": \"Madame\", \"category\": {\"usertype\": {\"usertype\": \"Women\"}, \"category\": \"Dress\"}}, {\"id\": 39, \"name\": \"Cotton Silk Hand Block Print Saree\", \"price\": \"Rs. 3000\", \"brand\": \"Biba\", \"category\": {\"usertype\": {\"usertype\": \"Women\"}, \"category\": \"Saree\"}}, {\"id\": 40, \"name\": \"Rust Red Linen Saree\", \"price\": \"Rs. 3500\", \"brand\": \"Biba\", \"category\": {\"usertype\": {\"usertype\": \"Women\"}, \"category\": \"Saree\"}}, {\"id\": 41, \"name\": \"Beautiful Peacock Blue Cotton Linen Saree\", \"price\": \"Rs. 5000\", \"brand\": \"Madame\", \"category\": {\"usertype\": {\"usertype\": \"Women\"}, \"category\": \"Saree\"}}, {\"id\": 42, \"name\": \"Lace Top For Women\", \"price\": \"Rs. 1400\", \"brand\": \"Mast & Harbour\", \"category\": {\"usertype\": {\"usertype\": \"Women\"}, \"category\": \"Tops\"}}, {\"id\": 43, \"name\": \"GRAPHIC DESIGN MEN T SHIRT - BLUE\", \"price\": \"Rs. 1389\", \"brand\": \"Mast & Harbour\", \"category\": {\"usertype\": {\"usertype\": \"Men\"}, \"category\": \"Tshirts\"}}]}' to have property 'products'","trace":"AssertionError: expected '{\"responseCode\": 200, \"products\": [{\"id\": 1, \"name\": \"Blue Top\", \"price\": \"Rs. 500\", \"brand\": \"Polo\", \"category\": {\"usertype\": {\"usertype\": \"Women\"}, \"category\": \"Tops\"}}, {\"id\": 2, \"name\": \"Men Tshirt\", \"price\": \"Rs. 400\", \"brand\": \"H&M\", \"category\": {\"usertype\": {\"usertype\": \"Men\"}, \"category\": \"Tshirts\"}}, {\"id\": 3, \"name\": \"Sleeveless Dress\", \"price\": \"Rs. 1000\", \"brand\": \"Madame\", \"category\": {\"usertype\": {\"usertype\": \"Women\"}, \"category\": \"Dress\"}}, {\"id\": 4, \"name\": \"Stylish Dress\", \"price\": \"Rs. 1500\", \"brand\": \"Madame\", \"category\": {\"usertype\": {\"usertype\": \"Women\"}, \"category\": \"Dress\"}}, {\"id\": 5, \"name\": \"Winter Top\", \"price\": \"Rs. 600\", \"brand\": \"Mast & Harbour\", \"category\": {\"usertype\": {\"usertype\": \"Women\"}, \"category\": \"Tops\"}}, {\"id\": 6, \"name\": \"Summer White Top\", \"price\": \"Rs. 400\", \"brand\": \"H&M\", \"category\": {\"usertype\": {\"usertype\": \"Women\"}, \"category\": \"Tops\"}}, {\"id\": 7, \"name\": \"Madame Top For Women\", \"price\": \"Rs. 1000\", \"brand\": \"Madame\", \"category\": {\"usertype\": {\"usertype\": \"Women\"}, \"category\": \"Tops\"}}, {\"id\": 8, \"name\": \"Fancy Green Top\", \"price\": \"Rs. 700\", \"brand\": \"Polo\", \"category\": {\"usertype\": {\"usertype\": \"Women\"}, \"category\": \"Tops\"}}, {\"id\": 11, \"name\": \"Sleeves Printed Top - White\", \"price\": \"Rs. 499\", \"brand\": \"Babyhug\", \"category\": {\"usertype\": {\"usertype\": \"Kids\"}, \"category\": \"Tops & Shirts\"}}, {\"id\": 12, \"name\": \"Half Sleeves Top Schiffli Detailing - Pink\", \"price\": \"Rs. 359\", \"brand\": \"Babyhug\", \"category\": {\"usertype\": {\"usertype\": \"Kids\"}, \"category\": \"Tops & Shirts\"}}, {\"id\": 13, \"name\": \"Frozen Tops For Kids\", \"price\": \"Rs. 278\", \"brand\": \"Allen Solly Junior\", \"category\": {\"usertype\": {\"usertype\": \"Kids\"}, \"category\": \"Tops & Shirts\"}}, {\"id\": 14, \"name\": \"Full Sleeves Top Cherry - Pink\", \"price\": \"Rs. 679\", \"brand\": \"Kookie Kids\", \"category\": {\"usertype\": {\"usertype\": \"Kids\"}, \"category\": \"Tops & Shirts\"}}, {\"id\": 15, \"name\": \"Printed Off Shoulder Top - White\", \"price\": \"Rs. 315\", \"brand\": \"Babyhug\", \"category\": {\"usertype\": {\"usertype\": \"Kids\"}, \"category\": \"Tops & Shirts\"}}, {\"id\": 16, \"name\": \"Sleeves Top and Short - Blue & Pink\", \"price\": \"Rs. 478\", \"brand\": \"Babyhug\", \"category\": {\"usertype\": {\"usertype\": \"Kids\"}, \"category\": \"Dress\"}}, {\"id\": 18, \"name\": \"Little Girls Mr. Panda Shirt\", \"price\": \"Rs. 1200\", \"brand\": \"Kookie Kids\", \"category\": {\"usertype\": {\"usertype\": \"Kids\"}, \"category\": \"Tops & Shirts\"}}, {\"id\": 19, \"name\": \"Sleeveless Unicorn Patch Gown - Pink\", \"price\": \"Rs. 1050\", \"brand\": \"Allen Solly Junior\", \"category\": {\"usertype\": {\"usertype\": \"Kids\"}, \"category\": \"Dress\"}}, {\"id\": 20, \"name\": \"Cotton Mull Embroidered Dress\", \"price\": \"Rs. 1190\", \"brand\": \"Kookie Kids\", \"category\": {\"usertype\": {\"usertype\": \"Kids\"}, \"category\": \"Dress\"}}, {\"id\": 21, \"name\": \"Blue Cotton Indie Mickey Dress\", \"price\": \"Rs. 1530\", \"brand\": \"Biba\", \"category\": {\"usertype\": {\"usertype\": \"Kids\"}, \"category\": \"Dress\"}}, {\"id\": 22, \"name\": \"Long Maxi Tulle Fancy Dress Up Outfits -Pink\", \"price\": \"Rs. 1600\", \"brand\": \"Biba\", \"category\": {\"usertype\": {\"usertype\": \"Kids\"}, \"category\": \"Dress\"}}, {\"id\": 23, \"name\": \"Sleeveless Unicorn Print Fit & Flare Net Dress - Multi\", \"price\": \"Rs. 1100\", \"brand\": \"Biba\", \"category\": {\"usertype\": {\"usertype\": \"Kids\"}, \"category\": \"Dress\"}}, {\"id\": 24, \"name\": \"Colour Blocked Shirt \\\\u2013 Sky Blue\", \"price\": \"Rs. 849\", \"brand\": \"Allen Solly Junior\", \"category\": {\"usertype\": {\"usertype\": \"Kids\"}, \"category\": \"Tops & Shirts\"}}, {\"id\": 28, \"name\": \"Pure Cotton V-Neck T-Shirt\", \"price\": \"Rs. 1299\", \"brand\": \"H&M\", \"category\": {\"usertype\": {\"usertype\": \"Men\"}, \"category\": \"Tshirts\"}}, {\"id\": 29, \"name\": \"Green Side Placket Detail T-Shirt\", \"price\": \"Rs. 1000\", \"brand\": \"Polo\", \"category\": {\"usertype\": {\"usertype\": \"Men\"}, \"category\": \"Tshirts\"}}, {\"id\": 30, \"name\": \"Premium Polo T-Shirts\", \"price\": \"Rs. 1500\", \"brand\": \"Polo\", \"category\": {\"usertype\": {\"usertype\": \"Men\"}, \"category\": \"Tshirts\"}}, {\"id\": 31, \"name\": \"Pure Cotton Neon Green Tshirt\", \"price\": \"Rs. 850\", \"brand\": \"H&M\", \"category\": {\"usertype\": {\"usertype\": \"Men\"}, \"category\": \"Tshirts\"}}, {\"id\": 33, \"name\": \"Soft Stretch Jeans\", \"price\": \"Rs. 799\", \"brand\": \"Polo\", \"category\": {\"usertype\": {\"usertype\": \"Men\"}, \"category\": \"Jeans\"}}, {\"id\": 35, \"name\": \"Regular Fit Straight Jeans\", \"price\": \"Rs. 1200\", \"brand\": \"H&M\", \"category\": {\"usertype\": {\"usertype\": \"Men\"}, \"category\": \"Jeans\"}}, {\"id\": 37, \"name\": \"Grunt Blue Slim Fit Jeans\", \"price\": \"Rs. 1400\", \"brand\": \"Polo\", \"category\": {\"usertype\": {\"usertype\": \"Men\"}, \"category\": \"Jeans\"}}, {\"id\": 38, \"name\": \"Rose Pink Embroidered Maxi Dress\", \"price\": \"Rs. 2300\", \"brand\": \"Madame\", \"category\": {\"usertype\": {\"usertype\": \"Women\"}, \"category\": \"Dress\"}}, {\"id\": 39, \"name\": \"Cotton Silk Hand Block Print Saree\", \"price\": \"Rs. 3000\", \"brand\": \"Biba\", \"category\": {\"usertype\": {\"usertype\": \"Women\"}, \"category\": \"Saree\"}}, {\"id\": 40, \"name\": \"Rust Red Linen Saree\", \"price\": \"Rs. 3500\", \"brand\": \"Biba\", \"category\": {\"usertype\": {\"usertype\": \"Women\"}, \"category\": \"Saree\"}}, {\"id\": 41, \"name\": \"Beautiful Peacock Blue Cotton Linen Saree\", \"price\": \"Rs. 5000\", \"brand\": \"Madame\", \"category\": {\"usertype\": {\"usertype\": \"Women\"}, \"category\": \"Saree\"}}, {\"id\": 42, \"name\": \"Lace Top For Women\", \"price\": \"Rs. 1400\", \"brand\": \"Mast & Harbour\", \"category\": {\"usertype\": {\"usertype\": \"Women\"}, \"category\": \"Tops\"}}, {\"id\": 43, \"name\": \"GRAPHIC DESIGN MEN T SHIRT - BLUE\", \"price\": \"Rs. 1389\", \"brand\": \"Mast & Harbour\", \"category\": {\"usertype\": {\"usertype\": \"Men\"}, \"category\": \"Tshirts\"}}]}' to have property 'products'\n    at Context.eval (webpack:///./cypress/e2e/api_tests.cy.js:7:36)\n    at getRet (https://www.automationexercise.com/__cypress/runner/cypress_runner.js:121565:20)\n    at tryCatcher (https://www.automationexercise.com/__cypress/runner/cypress_runner.js:1777:23)\n    at Promise.attempt.Promise.try (https://www.automationexercise.com/__cypress/runner/cypress_runner.js:4285:29)\n    at Context.thenFn (https://www.automationexercise.com/__cypress/runner/cypress_runner.js:121576:66)\n    at Context.then (https://www.automationexercise.com/__cypress/runner/cypress_runner.js:121827:21)"},"stage":"finished","steps":[{"status":"passed","statusDetails":{},"stage":"finished","steps":[],"attachments":[],"parameters":[],"start":1758504740381,"name":"request (\"GET\"; \"https://automationexercise.com/api/productsList\")","stop":1758504741313},{"status":"failed","statusDetails":{},"stage":"finished","steps":[],"attachments":[],"parameters":[{"name":"actual","value":"{\"responseCode\": 200, \"products\": [{\"id\": 1, \"name\": \"Blue Top\", \"price\": \"Rs. 500\", \"brand\": \"Polo\", \"category\": {\"usertype\": {\"usertype\": \"Women\"}, \"category\": \"Tops\"}}, {\"id\": 2, \"name\": \"Men Tshirt\", \"price\": \"Rs. 400\", \"brand\": \"H&M\", \"category\": {\"usertype\": {\"usertype\": \"Men\"}, \"category\": \"Tshirts\"}}, {\"id\": 3, \"name\": \"Sleeveless Dress\", \"price\": \"Rs. 1000\", \"brand\": \"Madame\", \"category\": {\"usertype\": {\"usertype\": \"Women\"}, \"category\": \"Dress\"}}, {\"id\": 4, \"name\": \"Stylish Dress\", \"price\": \"Rs. 1500\", \"brand\": \"Madame\", \"category\": {\"usertype\": {\"usertype\": \"Women\"}, \"category\": \"Dress\"}}, {\"id\": 5, \"name\": \"Winter Top\", \"price\": \"Rs. 600\", \"brand\": \"Mast & Harbour\", \"category\": {\"usertype\": {\"usertype\": \"Women\"}, \"category\": \"Tops\"}}, {\"id\": 6, \"name\": \"Summer White Top\", \"price\": \"Rs. 400\", \"brand\": \"H&M\", \"category\": {\"usertype\": {\"usertype\": \"Women\"}, \"category\": \"Tops\"}}, {\"id\": 7, \"name\": \"Madame Top For Women\", \"price\": \"Rs. 1000\", \"brand\": \"Madame\", \"category\": {\"usertype\": {\"usertype\": \"Women\"}, \"category\": \"Tops\"}}, {\"id\": 8, \"name\": \"Fancy Green Top\", \"price\": \"Rs. 700\", \"brand\": \"Polo\", \"category\": {\"usertype\": {\"usertype\": \"Women\"}, \"category\": \"Tops\"}}, {\"id\": 11, \"name\": \"Sleeves Printed Top - White\", \"price\": \"Rs. 499\", \"brand\": \"Babyhug\", \"category\": {\"usertype\": {\"usertype\": \"Kids\"}, \"category\": \"Tops & Shirts\"}}, {\"id\": 12, \"name\": \"Half Sleeves Top Schiffli Detailing - Pink\", \"price\": \"Rs. 359\", \"brand\": \"Babyhug\", \"category\": {\"usertype\": {\"usertype\": \"Kids\"}, \"category\": \"Tops & Shirts\"}}, {\"id\": 13, \"name\": \"Frozen Tops For Kids\", \"price\": \"Rs. 278\", \"brand\": \"Allen Solly Junior\", \"category\": {\"usertype\": {\"usertype\": \"Kids\"}, \"category\": \"Tops & Shirts\"}}, {\"id\": 14, \"name\": \"Full Sleeves Top Cherry - Pink\", \"price\": \"Rs. 679\", \"brand\": \"Kookie Kids\", \"category\": {\"usertype\": {\"usertype\": \"Kids\"}, \"category\": \"Tops & Shirts\"}}, {\"id\": 15, \"name\": \"Printed Off Shoulder Top - White\", \"price\": \"Rs. 315\", \"brand\": \"Babyhug\", \"category\": {\"usertype\": {\"usertype\": \"Kids\"}, \"category\": \"Tops & Shirts\"}}, {\"id\": 16, \"name\": \"Sleeves Top and Short - Blue & Pink\", \"price\": \"Rs. 478\", \"brand\": \"Babyhug\", \"category\": {\"usertype\": {\"usertype\": \"Kids\"}, \"category\": \"Dress\"}}, {\"id\": 18, \"name\": \"Little Girls Mr. Panda Shirt\", \"price\": \"Rs. 1200\", \"brand\": \"Kookie Kids\", \"category\": {\"usertype\": {\"usertype\": \"Kids\"}, \"category\": \"Tops & Shirts\"}}, {\"id\": 19, \"name\": \"Sleeveless Unicorn Patch Gown - Pink\", \"price\": \"Rs. 1050\", \"brand\": \"Allen Solly Junior\", \"category\": {\"usertype\": {\"usertype\": \"Kids\"}, \"category\": \"Dress\"}}, {\"id\": 20, \"name\": \"Cotton Mull Embroidered Dress\", \"price\": \"Rs. 1190\", \"brand\": \"Kookie Kids\", \"category\": {\"usertype\": {\"usertype\": \"Kids\"}, \"category\": \"Dress\"}}, {\"id\": 21, \"name\": \"Blue Cotton Indie Mickey Dress\", \"price\": \"Rs. 1530\", \"brand\": \"Biba\", \"category\": {\"usertype\": {\"usertype\": \"Kids\"}, \"category\": \"Dress\"}}, {\"id\": 22, \"name\": \"Long Maxi Tulle Fancy Dress Up Outfits -Pink\", \"price\": \"Rs. 1600\", \"brand\": \"Biba\", \"category\": {\"usertype\": {\"usertype\": \"Kids\"}, \"category\": \"Dress\"}}, {\"id\": 23, \"name\": \"Sleeveless Unicorn Print Fit & Flare Net Dress - Multi\", \"price\": \"Rs. 1100\", \"brand\": \"Biba\", \"category\": {\"usertype\": {\"usertype\": \"Kids\"}, \"category\": \"Dress\"}}, {\"id\": 24, \"name\": \"Colour Blocked Shirt \\u2013 Sky Blue\", \"price\": \"Rs. 849\", \"brand\": \"Allen Solly Junior\", \"category\": {\"usertype\": {\"usertype\": \"Kids\"}, \"category\": \"Tops & Shirts\"}}, {\"id\": 28, \"name\": \"Pure Cotton V-Neck T-Shirt\", \"price\": \"Rs. 1299\", \"brand\": \"H&M\", \"category\": {\"usertype\": {\"usertype\": \"Men\"}, \"category\": \"Tshirts\"}}, {\"id\": 29, \"name\": \"Green Side Placket Detail T-Shirt\", \"price\": \"Rs. 1000\", \"brand\": \"Polo\", \"category\": {\"usertype\": {\"usertype\": \"Men\"}, \"category\": \"Tshirts\"}}, {\"id\": 30, \"name\": \"Premium Polo T-Shirts\", \"price\": \"Rs. 1500\", \"brand\": \"Polo\", \"category\": {\"usertype\": {\"usertype\": \"Men\"}, \"category\": \"Tshirts\"}}, {\"id\": 31, \"name\": \"Pure Cotton Neon Green Tshirt\", \"price\": \"Rs. 850\", \"brand\": \"H&M\", \"category\": {\"usertype\": {\"usertype\": \"Men\"}, \"category\": \"Tshirts\"}}, {\"id\": 33, \"name\": \"Soft Stretch Jeans\", \"price\": \"Rs. 799\", \"brand\": \"Polo\", \"category\": {\"usertype\": {\"usertype\": \"Men\"}, \"category\": \"Jeans\"}}, {\"id\": 35, \"name\": \"Regular Fit Straight Jeans\", \"price\": \"Rs. 1200\", \"brand\": \"H&M\", \"category\": {\"usertype\": {\"usertype\": \"Men\"}, \"category\": \"Jeans\"}}, {\"id\": 37, \"name\": \"Grunt Blue Slim Fit Jeans\", \"price\": \"Rs. 1400\", \"brand\": \"Polo\", \"category\": {\"usertype\": {\"usertype\": \"Men\"}, \"category\": \"Jeans\"}}, {\"id\": 38, \"name\": \"Rose Pink Embroidered Maxi Dress\", \"price\": \"Rs. 2300\", \"brand\": \"Madame\", \"category\": {\"usertype\": {\"usertype\": \"Women\"}, \"category\": \"Dress\"}}, {\"id\": 39, \"name\": \"Cotton Silk Hand Block Print Saree\", \"price\": \"Rs. 3000\", \"brand\": \"Biba\", \"category\": {\"usertype\": {\"usertype\": \"Women\"}, \"category\": \"Saree\"}}, {\"id\": 40, \"name\": \"Rust Red Linen Saree\", \"price\": \"Rs. 3500\", \"brand\": \"Biba\", \"category\": {\"usertype\": {\"usertype\": \"Women\"}, \"category\": \"Saree\"}}, {\"id\": 41, \"name\": \"Beautiful Peacock Blue Cotton Linen Saree\", \"price\": \"Rs. 5000\", \"brand\": \"Madame\", \"category\": {\"usertype\": {\"usertype\": \"Women\"}, \"category\": \"Saree\"}}, {\"id\": 42, \"name\": \"Lace Top For Women\", \"price\": \"Rs. 1400\", \"brand\": \"Mast & Harbour\", \"category\": {\"usertype\": {\"usertype\": \"Women\"}, \"category\": \"Tops\"}}, {\"id\": 43, \"name\": \"GRAPHIC DESIGN MEN T SHIRT - BLUE\", \"price\": \"Rs. 1389\", \"brand\": \"Mast & Harbour\", \"category\": {\"usertype\": {\"usertype\": \"Men\"}, \"category\": \"Tshirts\"}}]}"}],"start":1758504741575,"name":"assert expected **{\"responseCode\": 200, \"products\": [{\"id\": 1, \"name\": \"Blue Top\", \"price\": \"Rs. 500\", \"brand\": \"Polo\", \"category\": {\"usertype\": {\"usertype\": \"Women\"}, \"category\": \"Tops\"}}, {\"id\": 2, \"name\": \"Men Tshirt\", \"price\": \"Rs. 400\", \"brand\": \"H&M\", \"category\": {\"usertype\": {\"usertype\": \"Men\"}, \"category\": \"Tshirts\"}}, {\"id\": 3, \"name\": \"Sleeveless Dress\", \"price\": \"Rs. 1000\", \"brand\": \"Madame\", \"category\": {\"usertype\": {\"usertype\": \"Women\"}, \"category\": \"Dress\"}}, {\"id\": 4, \"name\": \"Stylish Dress\", \"price\": \"Rs. 1500\", \"brand\": \"Madame\", \"category\": {\"usertype\": {\"usertype\": \"Women\"}, \"category\": \"Dress\"}}, {\"id\": 5, \"name\": \"Winter Top\", \"price\": \"Rs. 600\", \"brand\": \"Mast & Harbour\", \"category\": {\"usertype\": {\"usertype\": \"Women\"}, \"category\": \"Tops\"}}, {\"id\": 6, \"name\": \"Summer White Top\", \"price\": \"Rs. 400\", \"brand\": \"H&M\", \"category\": {\"usertype\": {\"usertype\": \"Women\"}, \"category\": \"Tops\"}}, {\"id\": 7, \"name\": \"Madame Top For Women\", \"price\": \"Rs. 1000\", \"brand\": \"Madame\", \"category\": {\"usertype\": {\"usertype\": \"Women\"}, \"category\": \"Tops\"}}, {\"id\": 8, \"name\": \"Fancy Green Top\", \"price\": \"Rs. 700\", \"brand\": \"Polo\", \"category\": {\"usertype\": {\"usertype\": \"Women\"}, \"category\": \"Tops\"}}, {\"id\": 11, \"name\": \"Sleeves Printed Top - White\", \"price\": \"Rs. 499\", \"brand\": \"Babyhug\", \"category\": {\"usertype\": {\"usertype\": \"Kids\"}, \"category\": \"Tops & Shirts\"}}, {\"id\": 12, \"name\": \"Half Sleeves Top Schiffli Detailing - Pink\", \"price\": \"Rs. 359\", \"brand\": \"Babyhug\", \"category\": {\"usertype\": {\"usertype\": \"Kids\"}, \"category\": \"Tops & Shirts\"}}, {\"id\": 13, \"name\": \"Frozen Tops For Kids\", \"price\": \"Rs. 278\", \"brand\": \"Allen Solly Junior\", \"category\": {\"usertype\": {\"usertype\": \"Kids\"}, \"category\": \"Tops & Shirts\"}}, {\"id\": 14, \"name\": \"Full Sleeves Top Cherry - Pink\", \"price\": \"Rs. 679\", \"brand\": \"Kookie Kids\", \"category\": {\"usertype\": {\"usertype\": \"Kids\"}, \"category\": \"Tops & Shirts\"}}, {\"id\": 15, \"name\": \"Printed Off Shoulder Top - White\", \"price\": \"Rs. 315\", \"brand\": \"Babyhug\", \"category\": {\"usertype\": {\"usertype\": \"Kids\"}, \"category\": \"Tops & Shirts\"}}, {\"id\": 16, \"name\": \"Sleeves Top and Short - Blue & Pink\", \"price\": \"Rs. 478\", \"brand\": \"Babyhug\", \"category\": {\"usertype\": {\"usertype\": \"Kids\"}, \"category\": \"Dress\"}}, {\"id\": 18, \"name\": \"Little Girls Mr. Panda Shirt\", \"price\": \"Rs. 1200\", \"brand\": \"Kookie Kids\", \"category\": {\"usertype\": {\"usertype\": \"Kids\"}, \"category\": \"Tops & Shirts\"}}, {\"id\": 19, \"name\": \"Sleeveless Unicorn Patch Gown - Pink\", \"price\": \"Rs. 1050\", \"brand\": \"Allen Solly Junior\", \"category\": {\"usertype\": {\"usertype\": \"Kids\"}, \"category\": \"Dress\"}}, {\"id\": 20, \"name\": \"Cotton Mull Embroidered Dress\", \"price\": \"Rs. 1190\", \"brand\": \"Kookie Kids\", \"category\": {\"usertype\": {\"usertype\": \"Kids\"}, \"category\": \"Dress\"}}, {\"id\": 21, \"name\": \"Blue Cotton Indie Mickey Dress\", \"price\": \"Rs. 1530\", \"brand\": \"Biba\", \"category\": {\"usertype\": {\"usertype\": \"Kids\"}, \"category\": \"Dress\"}}, {\"id\": 22, \"name\": \"Long Maxi Tulle Fancy Dress Up Outfits -Pink\", \"price\": \"Rs. 1600\", \"brand\": \"Biba\", \"category\": {\"usertype\": {\"usertype\": \"Kids\"}, \"category\": \"Dress\"}}, {\"id\": 23, \"name\": \"Sleeveless Unicorn Print Fit & Flare Net Dress - Multi\", \"price\": \"Rs. 1100\", \"brand\": \"Biba\", \"category\": {\"usertype\": {\"usertype\": \"Kids\"}, \"category\": \"Dress\"}}, {\"id\": 24, \"name\": \"Colour Blocked Shirt \\\\u2013 Sky Blue\", \"price\": \"Rs. 849\", \"brand\": \"Allen Solly Junior\", \"category\": {\"usertype\": {\"usertype\": \"Kids\"}, \"category\": \"Tops & Shirts\"}}, {\"id\": 28, \"name\": \"Pure Cotton V-Neck T-Shirt\", \"price\": \"Rs. 1299\", \"brand\": \"H&M\", \"category\": {\"usertype\": {\"usertype\": \"Men\"}, \"category\": \"Tshirts\"}}, {\"id\": 29, \"name\": \"Green Side Placket Detail T-Shirt\", \"price\": \"Rs. 1000\", \"brand\": \"Polo\", \"category\": {\"usertype\": {\"usertype\": \"Men\"}, \"category\": \"Tshirts\"}}, {\"id\": 30, \"name\": \"Premium Polo T-Shirts\", \"price\": \"Rs. 1500\", \"brand\": \"Polo\", \"category\": {\"usertype\": {\"usertype\": \"Men\"}, \"category\": \"Tshirts\"}}, {\"id\": 31, \"name\": \"Pure Cotton Neon Green Tshirt\", \"price\": \"Rs. 850\", \"brand\": \"H&M\", \"category\": {\"usertype\": {\"usertype\": \"Men\"}, \"category\": \"Tshirts\"}}, {\"id\": 33, \"name\": \"Soft Stretch Jeans\", \"price\": \"Rs. 799\", \"brand\": \"Polo\", \"category\": {\"usertype\": {\"usertype\": \"Men\"}, \"category\": \"Jeans\"}}, {\"id\": 35, \"name\": \"Regular Fit Straight Jeans\", \"price\": \"Rs. 1200\", \"brand\": \"H&M\", \"category\": {\"usertype\": {\"usertype\": \"Men\"}, \"category\": \"Jeans\"}}, {\"id\": 37, \"name\": \"Grunt Blue Slim Fit Jeans\", \"price\": \"Rs. 1400\", \"brand\": \"Polo\", \"category\": {\"usertype\": {\"usertype\": \"Men\"}, \"category\": \"Jeans\"}}, {\"id\": 38, \"name\": \"Rose Pink Embroidered Maxi Dress\", \"price\": \"Rs. 2300\", \"brand\": \"Madame\", \"category\": {\"usertype\": {\"usertype\": \"Women\"}, \"category\": \"Dress\"}}, {\"id\": 39, \"name\": \"Cotton Silk Hand Block Print Saree\", \"price\": \"Rs. 3000\", \"brand\": \"Biba\", \"category\": {\"usertype\": {\"usertype\": \"Women\"}, \"category\": \"Saree\"}}, {\"id\": 40, \"name\": \"Rust Red Linen Saree\", \"price\": \"Rs. 3500\", \"brand\": \"Biba\", \"category\": {\"usertype\": {\"usertype\": \"Women\"}, \"category\": \"Saree\"}}, {\"id\": 41, \"name\": \"Beautiful Peacock Blue Cotton Linen Saree\", \"price\": \"Rs. 5000\", \"brand\": \"Madame\", \"category\": {\"usertype\": {\"usertype\": \"Women\"}, \"category\": \"Saree\"}}, {\"id\": 42, \"name\": \"Lace Top For Women\", \"price\": \"Rs. 1400\", \"brand\": \"Mast & Harbour\", \"category\": {\"usertype\": {\"usertype\": \"Women\"}, \"category\": \"Tops\"}}, {\"id\": 43, \"name\": \"GRAPHIC DESIGN MEN T SHIRT - BLUE\", \"price\": \"Rs. 1389\", \"brand\": \"Mast & Harbour\", \"category\": {\"usertype\": {\"usertype\": \"Men\"}, \"category\": \"Tshirts\"}}]}** to have property **products**","stop":1758504741575},{"status":"passed","statusDetails":{},"stage":"finished","steps":[],"attachments":[],"parameters":[{"name":"actual","value":200},{"name":"expected","value":200}],"start":1758504741575,"name":"assert expected **200** to equal **200**","stop":1758504741575}],"attachments":[{"name":"api_tests.cy.js:2025-09-22T01:32:21.396Z","type":"image/png","source":"d4c64812-a0a1-4033-9476-41b6240b3139-attachment.png"}],"parameters":[],"labels":[{"name":"package","value":"cypress.e2e.api_tests.cy.js"},{"name":"suite","value":"Testes da API"}],"links":[],"start":1758504740377,"name":"Deve pegar a lista de produtos na API","fullName":"Deve pegar a lista de produtos na API","stop":1758504741576}